{
  "cards": [
    {
      "adaptive": {
        "$schema": "http://adaptivecards.io/schemas/adaptive-card.json",
        "body": [
          {
            "text": "kokoro-onnx weights are not bundled.",
            "type": "TextBlock",
            "wrap": true
          }
        ],
        "type": "AdaptiveCard",
        "version": "1.5"
      },
      "body": {
        "engineId": "kokoro_onnx",
        "status": "weights_absent",
        "summary": "The Python SDK can synthesize when GEN_AUDIO_KOKORO_MODEL and GEN_AUDIO_KOKORO_VOICES point at local files. Those weights are not in this repo."
      },
      "id": "engine-kokoro",
      "kind": "EngineStatus",
      "title": "kokoro-onnx",
      "uid": "ga:card:wgi2proc543zzqzfa2ydlfbnl4"
    },
    {
      "body": {
        "engineId": "vibevoice",
        "status": "implemented",
        "summary": "Isolated VibeVoice CPU worker. Readiness depends on the configured checkpoint, tokenizer, reference voices and free RAM."
      },
      "id": "engine-vibevoice",
      "kind": "EngineStatus",
      "title": "VibeVoice",
      "uid": "ga:card:bvm7yk6rqz5ir4ms5oej62rhra"
    },
    {
      "body": {
        "engineId": "magpie",
        "status": "external",
        "summary": "Compare slot for Magpie TTS (Sofia/Jason in the 2026-10-06 notes). No adapter and no weights in this app."
      },
      "id": "engine-magpie",
      "kind": "EngineStatus",
      "title": "Magpie",
      "uid": "ga:card:fijqhsk7xhpcgehxdeexal6jnm"
    },
    {
      "body": {
        "engineId": "pocket_tts",
        "status": "external",
        "summary": "Kyutai Pocket TTS is a separate model, not PersonaPlex. No adapter in this app."
      },
      "id": "engine-pocket",
      "kind": "EngineStatus",
      "title": "Pocket TTS",
      "uid": "ga:card:nmfqip53e5thxk43egqjzl27da"
    },
    {
      "body": {
        "engineId": "kokoro_dayour",
        "status": "library",
        "summary": "dayour/kokoro torch runtime. Its real Library WAV and rev 3 cube ship here. Not vendored; this repo has no synth adapter."
      },
      "id": "engine-kokoro-dayour",
      "kind": "EngineStatus",
      "title": "dayour/kokoro",
      "uid": "ga:card:zoap44kodcb55zvwsw5cld4qwm"
    },
    {
      "body": {
        "engineId": "misaki",
        "status": "library",
        "summary": "misaki is grapheme-to-phoneme for Kokoro. G2P only: it emits phonemes, not a waveform. Its audio is the misaki→kokoro clip."
      },
      "id": "engine-misaki",
      "kind": "EngineStatus",
      "title": "misaki",
      "uid": "ga:card:axbliqbwn7uidcc4pjfbivmlli"
    },
    {
      "body": {
        "disclaimer": "Browser spectrogram of the selected voice profile, not a podcast render and not a Python spectrogram.",
        "notPodcast": true,
        "source": "fixture-tone"
      },
      "id": "spec-fixture",
      "kind": "SpectrogramPanel",
      "span": 2,
      "title": "Spectrogram panel",
      "uid": "ga:card:rt6iial7o6xf7oetud56lcmv54"
    },
    {
      "body": {
        "disclaimer": "WebGL point cloud of the same fixture tone. Not a measured podcast cube.",
        "notPodcast": true,
        "source": "fixture-tone"
      },
      "id": "cube-fixture",
      "kind": "Cube3D",
      "span": 2,
      "title": "Inverse-HDR cube",
      "uid": "ga:card:eclezl34uhr3fuj6pukt7r6wkm"
    },
    {
      "body": {
        "sampleScript": true,
        "speakers": [
          {
            "id": "1",
            "name": "Alice",
            "voice": "af_heart"
          },
          {
            "id": "2",
            "name": "Frank",
            "voice": "am_michael"
          }
        ]
      },
      "id": "cast-sample",
      "kind": "PodcastCast",
      "title": "Sample cast",
      "uid": "ga:card:u73p3l6n7w2lelaz6kzpflydjy"
    },
    {
      "body": {
        "baseUrl": "http://<node>:8002/genaid-audio",
        "healthUrl": "http://<node>:8002/genaid-audio/health",
        "host": "<node>",
        "port": 8002,
        "probed": false,
        "role": "node"
      },
      "id": "serve-node",
      "kind": "ServeHealth",
      "title": "Node health",
      "uid": "ga:card:3kc35sblccksmpuwia6s5xobae"
    },
    {
      "body": {
        "baseUrl": "http://10.1.8.70:8002/genaid-audio",
        "healthUrl": "http://10.1.8.70:8002/genaid-audio/health",
        "host": "10.1.8.70",
        "port": 8002,
        "probed": false,
        "role": "shared-gateway"
      },
      "id": "serve-gateway",
      "kind": "ServeHealth",
      "title": "Shared gateway",
      "uid": "ga:card:ayvizyvubrzigxewm2bjzjmvam"
    },
    {
      "body": {
        "measuredHere": false,
        "rows": [
          {
            "engine": "pocket_tts",
            "metric": "teaser_wer",
            "note": "Short teaser ASR in those notes.",
            "unit": "WER",
            "value": "22.22%"
          },
          {
            "engine": "vibevoice",
            "metric": "teaser_wer",
            "note": "Full improved WAV was the preferred publish in those notes.",
            "unit": "WER",
            "value": "30.00%"
          },
          {
            "engine": "magpie",
            "metric": "teaser_wer",
            "note": "Short teaser. Hypothesis was short of the reference.",
            "unit": "WER",
            "value": "42.22%"
          },
          {
            "engine": "vibevoice",
            "metric": "bw95_hz",
            "note": "Full improved final. Not a new measurement.",
            "unit": "Hz",
            "value": "2670.5"
          },
          {
            "engine": "kokoro_onnx",
            "metric": "bw95_hz_raw",
            "note": "Raw file in those notes. Do not rank publish on inv-HDR alone.",
            "unit": "Hz",
            "value": "826.9"
          }
        ],
        "sourceNote": "Reference figures from the 2026-10-06 GenAID podcast compare notes. Not remeasured in this repository."
      },
      "id": "bench-ref",
      "kind": "BenchmarkCompare",
      "span": 3,
      "title": "Compare notes",
      "uid": "ga:card:qngf7e45ixbikcdywhenhtoibe"
    },
    {
      "body": {
        "authenticated": false,
        "connectorId": "mcp",
        "detail": "Stateless tool server. No vendor credential.",
        "mode": "local"
      },
      "id": "conn-mcp",
      "kind": "ConnectorStatus",
      "title": "MCP",
      "uid": "ga:card:3hv5wsdt3mrcylczexvlnfk6li"
    },
    {
      "body": {
        "authenticated": false,
        "connectorId": "acp",
        "detail": "ACP agent. sessionId exists because the protocol requires it.",
        "mode": "local"
      },
      "id": "conn-acp",
      "kind": "ConnectorStatus",
      "title": "ACP",
      "uid": "ga:card:pwlbnygt4dzqdyvwc6fwj6basy"
    },
    {
      "body": {
        "authenticated": false,
        "connectorId": "harness",
        "detail": "Plans tools and writes a JSONL trace. Does not invent speech.",
        "mode": "local"
      },
      "id": "conn-harness",
      "kind": "ConnectorStatus",
      "title": "Harness",
      "uid": "ga:card:ihkozqfhv44hffgriz6cu2rqre"
    },
    {
      "body": {
        "authenticated": false,
        "connectorId": "copilot",
        "detail": "GitHub Models bridge. Mock until a token is set and GEN_AUDIO_CONNECTOR_LIVE=1.",
        "mode": "mock"
      },
      "id": "conn-copilot",
      "kind": "ConnectorStatus",
      "title": "Copilot",
      "uid": "ga:card:oxeufq3ckwj4dxcvnv2uyih7ce"
    },
    {
      "body": {
        "authenticated": false,
        "connectorId": "claude",
        "detail": "Anthropic Messages API. Claude Code CLI stays off unless GEN_AUDIO_CLAUDE_CODE_CLI=1.",
        "mode": "mock"
      },
      "id": "conn-claude",
      "kind": "ConnectorStatus",
      "title": "Claude",
      "uid": "ga:card:tg4uitpjeeazn7rnuxtxyxag2m"
    },
    {
      "body": {
        "authenticated": false,
        "connectorId": "gpt",
        "detail": "OpenAI chat completions. Mock without OPENAI_API_KEY.",
        "mode": "mock"
      },
      "id": "conn-gpt",
      "kind": "ConnectorStatus",
      "title": "GPT",
      "uid": "ga:card:vyjhtyqvyqntcapxjbpgdhdd7i"
    },
    {
      "body": {
        "authenticated": false,
        "connectorId": "gemini",
        "detail": "Gemini generateContent. Mock without an API key.",
        "mode": "mock"
      },
      "id": "conn-gemini",
      "kind": "ConnectorStatus",
      "title": "Gemini",
      "uid": "ga:card:yzvustpx2xm6tnm2skebvrr46i"
    },
    {
      "body": {
        "accent": "General American",
        "adaptiveCard": {
          "$schema": "https://adaptivecards.io/schemas/adaptive-card.json",
          "actions": [
            {
              "data": {
                "arguments": {
                  "agents": [
                    "anton"
                  ]
                },
                "tool": "ui_set_sidepane"
              },
              "title": "Use Anton",
              "type": "Action.Submit"
            },
            {
              "data": {
                "arguments": {
                  "slide": "slide:studio"
                },
                "tool": "ui_navigate"
              },
              "title": "Gen-Audio desktop studio",
              "type": "Action.Submit"
            },
            {
              "data": {
                "arguments": {
                  "slide": "slide:library"
                },
                "tool": "ui_navigate"
              },
              "title": "Gen-Audio SDK and audio library",
              "type": "Action.Submit"
            }
          ],
          "body": [
            {
              "text": "Anton",
              "type": "TextBlock",
              "weight": "Bolder",
              "wrap": true
            },
            {
              "facts": [
                {
                  "title": "AgentName",
                  "value": "Anton"
                },
                {
                  "title": "Artist",